{
  "$schema": "https://schema.paradoc.dev/2026-10-02.json",
  "kind": "form",
  "name": "check-cli-totals-no-data",
  "version": "1.0.0",
  "title": "Check CLI totals-no-data fixture",
  "fields": {
    "amount": {
      "type": "number",
      "label": "Amount",
      "required": true,
      "visible": true
    },
    "currency": {
      "type": "text",
      "label": "Currency",
      "required": true,
      "visible": true
    }
  },
  "defs": {
    "total": {
      "type": "money",
      "label": "Total",
      "value": {
        "amount": "fields.amount",
        "currency": "fields.currency"
      }
    }
  },
  "layers": {
    "composition": {
      "kind": "file",
      "mimeType": "text/tsx",
      "path": "totals-no-data-composition.tsx",
      "title": "Composition"
    }
  }
}
