{
  "$schema": "https://schema.paradoc.dev/2026-10-02.json",
  "kind": "form",
  "name": "check-cli-remote-image",
  "version": "1.0.0",
  "title": "Check CLI remote-image fixture",
  "fields": {
    "name": {
      "type": "text",
      "label": "Name",
      "required": true,
      "visible": true
    }
  },
  "layers": {
    "composition": {
      "kind": "file",
      "mimeType": "text/tsx",
      "path": "remote-image-composition.tsx",
      "title": "Composition"
    }
  }
}
