{
  "$schema": "https://schema.paradoc.dev/2026-08-10.json",
  "kind": "form",
  "name": "pet-addendum",
  "version": "1.0.0",
  "title": "Pet Addendum",
  "parties": {
    "tenant": {
      "label": "Tenant"
    }
  },
  "fields": {
    "petName": {
      "type": "text",
      "label": "Pet name"
    },
    "stay": {
      "type": "duration",
      "label": "Length of stay",
      "default": "P1M"
    }
  },
  "layers": {
    "markdown": {
      "kind": "inline",
      "mimeType": "text/markdown",
      "text": "Pet: {{fields.petName}}\nTenant: {{signature(parties.tenant, \"tenantSignature\")}}",
      "signatures": {
        "tenantSignature": {
          "party": { "role": "tenant" },
          "type": "signature",
          "placement": "auto"
        }
      }
    }
  }
}
