{
  "$schema": "https://schema.paradoc.dev/2026-10-02.json",
  "kind": "form",
  "name": "purchase-agreement",
  "title": "Purchase Agreement",
  "version": "1.0.0",
  "fields": {
    "quantity": {
      "type": "number",
      "label": "Quantity",
      "required": true
    },
    "price": {
      "type": "money",
      "label": "Price",
      "required": true
    },
    "date": {
      "type": "date",
      "label": "Date",
      "required": true
    }
  },
  "parties": {
    "buyer": {
      "label": "Buyer",
      "signature": {
        "required": true
      },
      "partyType": "person"
    },
    "seller": {
      "label": "Seller",
      "signature": {
        "required": true
      },
      "partyType": "person"
    }
  },
  "defaultLayer": "markdown",
  "layers": {
    "markdown": {
      "kind": "inline",
      "mimeType": "text/markdown",
      "text": "# Purchase Agreement\n\n{{parties.buyer.name}} agrees to purchase {{fields.quantity}} units at {{fields.price}} each.\n{{parties.seller.name}} agrees to deliver by {{fields.date}}."
    }
  }
}
