{
  "$schema": "https://schema.paradoc.dev/2026-10-02.json",
  "kind": "form",
  "name": "check-cli-missing-layer",
  "version": "1.0.0",
  "title": "Check CLI missing-layer fixture",
  "fields": {
    "name": {
      "type": "text",
      "label": "Name",
      "required": true,
      "visible": true
    }
  }
}
